{
  "schemaVersion": 1,
  "stage": "STEP_2A_CONTENT_CONTRACT_ONLY",
  "date": "2026-10-24",
  "bankVersion": "diagnostic-v1-bank.2.0.0-candidate",
  "candidateRoot": "C:\\Users\\ksari\\OneDrive\\Desktop\\ai_ielts_coach_app\\docs\\reviews\\stage-1b\\diagnostic-question-bank-preparation\\v2.0.0-candidate",
  "stage1B": "NOT_AUTHORIZED",
  "stage2": "BLOCKED",
  "inputAuthority": [
    {
      "path": "docs/reviews/stage-1b/diagnostic-blueprint-preparation/DIAGNOSTIC_29_ITEM_INVENTORY.csv",
      "sha256": "05a4d738fb0228880b523e9662a6b86f27888952bee5383cfc0ca8e4917b6f4a",
      "bytes": 47316
    },
    {
      "path": "docs/reviews/stage-1b/diagnostic-blueprint-preparation/DIAGNOSTIC_LIFECYCLE_POLICY_PROPOSAL.md",
      "sha256": "3b6e54863b5ef592a992b98430f520a46f3429b2d7490bc1b7a85bd196dd6654",
      "bytes": 6921
    },
    {
      "path": "docs/reviews/stage-1b/diagnostic-blueprint-preparation/DIAGNOSTIC_MEDIA_AND_SOURCE_REVIEW.md",
      "sha256": "340fd5f1ade7233b475413d7b8fbb3b5a127d18f964289ddde23ff9869c2000d",
      "bytes": 9384
    },
    {
      "path": "docs/reviews/stage-1b/diagnostic-blueprint-preparation/DIAGNOSTIC_OWNER_DECISIONS_REQUIRED.md",
      "sha256": "470cce1b96affc8c9ca44cb064878d1753a826c242e21d74d7dbdc78671dc200",
      "bytes": 4465
    },
    {
      "path": "docs/reviews/stage-1b/diagnostic-blueprint-preparation/DIAGNOSTIC_QUESTION_AND_KEY_AUDIT.csv",
      "sha256": "9d5573d45e9b255c24fc45262cc715901cf5b4d72a593a971ef6f344e0bbd07a",
      "bytes": 14526
    },
    {
      "path": "docs/reviews/stage-1b/diagnostic-blueprint-preparation/DIAGNOSTIC_SCORING_ELIGIBILITY.csv",
      "sha256": "41b3f9df7daf4d3a50f02cb055e9df349325c2350b2ee2f79a2aa3a156561447",
      "bytes": 20321
    },
    {
      "path": "docs/reviews/stage-1b/diagnostic-blueprint-preparation/DIAGNOSTIC_TO_DASHBOARD_METRIC_CROSSWALK.csv",
      "sha256": "2fc09ab429ea909cf5ec11c84aae8a219baff05db6eb9c04ccc29cbb93ec7ad2",
      "bytes": 12156
    },
    {
      "path": "docs/reviews/stage-1b/diagnostic-blueprint-preparation/DIAGNOSTIC_V1_CONTRACT_PROPOSAL.md",
      "sha256": "c9eaa096c48416a3eb52d4e7a79a67f54c210910a7520629dfc94a10d0f9146b",
      "bytes": 11165
    },
    {
      "path": "docs/reviews/stage-1b/diagnostic-blueprint-preparation/STEP_2_EXECUTIVE_SUMMARY.md",
      "sha256": "a359fc68aaae74c04fbfbe03dc73849be561d18a926055b02e3ec7d9794a1adb",
      "bytes": 5567
    },
    {
      "path": "docs/reviews/stage-1b/diagnostic-blueprint-preparation/STEP_2_VALIDATION_AND_HASH_MANIFEST.json",
      "sha256": "17247f1a1712f2c2e96ec6e283a7131a4fa518aabac24efaa79f9059e5e525b6",
      "bytes": 87236
    }
  ],
  "preservedInputs": [
    {
      "path": ".gitignore",
      "sha256": "f5e91884873be34b91ae6a81348dc248a82bc5a91e62ee43413ea3e1c2bcc8b9",
      "bytes": 69
    },
    {
      "path": "AUDIT.md",
      "sha256": "f89215deaa1b9e984fb8f9b50a443b4ea54a5cd96670cd35cadb300ba54af6e3",
      "bytes": 1810
    },
    {
      "path": "dist/assets/index-BynjdJC9.css",
      "sha256": "d8dafea72722b96d7f03c92b83e1385256c743f6ca7e7744750f9526eec2a2fa",
      "bytes": 101805
    },
    {
      "path": "dist/assets/index-gh88Nnsr.js",
      "sha256": "b289c132b2f8a8034219b8155f8f21e548e042e3f0d50b4bb6e24a2e041d5c68",
      "bytes": 408749
    },
    {
      "path": "dist/garden-plan.svg",
      "sha256": "990f3ad8cd5edac092803012229c0df249d22fe81781b4faf5cc189992553d26",
      "bytes": 868
    },
    {
      "path": "dist/index.html",
      "sha256": "b576e0778d4fe5e2644870075654926e06fd3fe2e9601ac60504f1e66a4fabcc",
      "bytes": 625
    },
    {
      "path": "dist/listening-diagnostic.wav",
      "sha256": "0e6c831770433da34f962cb03f9d4ddea33b335316f47b5f32b1640457dcd3c2",
      "bytes": 2378292
    },
    {
      "path": "dist/sample-reading.pdf",
      "sha256": "f2eb2a46d8bbdca15bd78b8f14662f746280b39c5f9a342fee54f679e7c3e391",
      "bytes": 3605
    },
    {
      "path": "docs/CHANGELOG.md",
      "sha256": "06962d753ea2394dd7a5dfd54679ebac06755708105b1f1dde3812cc0354be50",
      "bytes": 2106
    },
    {
      "path": "docs/DATA_CONTRACTS.md",
      "sha256": "49097f609748ff5d595d97c0d28c516f531efbbb72ac3cad07890d906c733a14",
      "bytes": 10307
    },
    {
      "path": "docs/DECISIONS.md",
      "sha256": "959480054e69b7c5e4b75a33e6e6aaef761bd3c1bbeb4d1986d7c077ec0cd053",
      "bytes": 4717
    },
    {
      "path": "docs/FEATURE_REGISTRY.md",
      "sha256": "0657e94075df48413d8cba410ea8556800ab47eedeee24bcd20aab29f514f1f4",
      "bytes": 6926
    },
    {
      "path": "docs/PROJECT_OVERVIEW.md",
      "sha256": "36a92181080796ee9490dd5ae25bdd7f51e92d99a283862c63df8f0768ee77cf",
      "bytes": 5996
    },
    {
      "path": "docs/reviews/stage-1a/AGENTS_MD_PROPOSAL.md",
      "sha256": "d9b2d72e3440e0d5b2e2ddfd5d1d261d494bd4b26b8fea2939a63fb0c4ec8636",
      "bytes": 1908
    },
    {
      "path": "docs/reviews/stage-1a/ARCHITECTURE_AND_ROUTES_PROPOSAL.md",
      "sha256": "955c2213343d99021f2d74d2082f572cf5ad654dd2f4468a0f0da46185bb98d7",
      "bytes": 8496
    },
    {
      "path": "docs/reviews/stage-1a/DASHBOARD_ACCEPTANCE_TEST_PLAN.md",
      "sha256": "fd2fada907cc7ae498c7696327a461a1c5ffb775a1de3cfa8f8ed9d42a6aff32",
      "bytes": 8620
    },
    {
      "path": "docs/reviews/stage-1a/DECISION_REQUIRED.md",
      "sha256": "41d23e3e51d3ea530f357aa81d459b1affa597ab14bd79ce7e7747041ae66e35",
      "bytes": 3151
    },
    {
      "path": "docs/reviews/stage-1a/DIAGNOSTIC_DYNAMIC_SOURCE_CONTRACT_PROPOSAL.md",
      "sha256": "53cf9958c9e7f10c336812f40f163faf8e49b7a071d077cfce0f3f0ed15e0a24",
      "bytes": 10980
    },
    {
      "path": "docs/reviews/stage-1a/evidence/AUTHORITATIVE_INPUTS.json",
      "sha256": "8bda4ec4dceae7740b48f47722959e1b8b23d395f09bbdf00391d9e5aa1aa54c",
      "bytes": 1756
    },
    {
      "path": "docs/reviews/stage-1a/evidence/BROWSER_SMOKE.json",
      "sha256": "65c241558c97620d872855a6a3dd70235e9c3917e9e429ddc86f0642d43aa886",
      "bytes": 1524
    },
    {
      "path": "docs/reviews/stage-1a/evidence/CHECK_EXECUTION.json",
      "sha256": "752e65b0ce3b88ff7016bc9f8180fabfb4dfaa01d762324634615b6fbb602bc3",
      "bytes": 2178
    },
    {
      "path": "docs/reviews/stage-1a/evidence/DEPENDENCY_LIFECYCLE_HOOKS.json",
      "sha256": "2b7dfd263d4472fdd048336af7ae7e1fba85e5e04187a17bdbbb08aa56b011cb",
      "bytes": 546
    },
    {
      "path": "docs/reviews/stage-1a/evidence/DEPENDENCY_SUMMARY.json",
      "sha256": "8357d220f726e993b772203ddb256d1069116c819785d281ceadfa21c8d1be28",
      "bytes": 14308
    },
    {
      "path": "docs/reviews/stage-1a/evidence/ENVIRONMENT_PREFLIGHT.json",
      "sha256": "8d2b6eb0d1c384afe02f7cf2bd727f9b63d80bc37d67d68c04857b2330def7e9",
      "bytes": 3411
    },
    {
      "path": "docs/reviews/stage-1a/evidence/production_build.log",
      "sha256": "4705529bc58497c1228f30d851b0f70e6a6a03f86e2d2d4f7f259750acf2f5cb",
      "bytes": 401
    },
    {
      "path": "docs/reviews/stage-1a/evidence/SKILL_SOURCE_EVIDENCE.json",
      "sha256": "d37fd428f6f1bf0d3716f8bd0db7c5dbd1bd9f92d9194de29e35d8283bb219f3",
      "bytes": 23530
    },
    {
      "path": "docs/reviews/stage-1a/evidence/SOURCE_SNAPSHOT_BEFORE.json",
      "sha256": "7ce9e96d2fc07abaee6efe99a1106a6cfb72922e7aea91e6d9fbdef7aac925e3",
      "bytes": 13993
    },
    {
      "path": "docs/reviews/stage-1a/evidence/test.log",
      "sha256": "52f8107b39534fb53e778f805b8a2ce38b309987b22bf452e54fa1de7fb4f331",
      "bytes": 721
    },
    {
      "path": "docs/reviews/stage-1a/evidence/typescript.log",
      "sha256": "e3b0c44298fc1c149afbf4c8996fb92427ae41e4649b934ca495991b7852b855",
      "bytes": 0
    },
    {
      "path": "docs/reviews/stage-1a/inputs/APPROVED_PLATFORM_FEATURE_SCOPE_V1_0.md",
      "sha256": "2f2aa1ce48905f3ef6bf4302e0f0f4fd37d42d3f2472e5ac59ac9cffcb3d27fd",
      "bytes": 9594
    },
    {
      "path": "docs/reviews/stage-1a/inputs/CODEX_STAGE_1A_MASTER_EXECUTION_PROMPT_V1_0.md",
      "sha256": "45813cca1fc4b636c430c6a4f98b5d416e0b32997b9aa12f7c08788c27867d81",
      "bytes": 10032
    },
    {
      "path": "docs/reviews/stage-1a/inputs/DIAGNOSTIC_AND_DASHBOARD_CONTRACT_V1_0.md",
      "sha256": "d72df49ac6a5eba37bb46ed9b53fdf6205dcb898d5e3c74fd27cc91570c2172e",
      "bytes": 7808
    },
    {
      "path": "docs/reviews/stage-1a/inputs/PROJECT_CONTINUITY_AND_DOCUMENTATION_RULES_V1_0.md",
      "sha256": "5dff10e8d921c92992c0bd8c17548deec2d86b115ebd6857f3262448c674f20d",
      "bytes": 5314
    },
    {
      "path": "docs/reviews/stage-1a/PERSONALIZED_DASHBOARD_METRIC_MATRIX.csv",
      "sha256": "2b413cbc9651178762e1991aa145ea04d289df8cf61c1c2a8e5f820f4208251b",
      "bytes": 15466
    },
    {
      "path": "docs/reviews/stage-1a/PROTOTYPE_REUSE_MATRIX.csv",
      "sha256": "6e22d9fb879bb21d2a59cb216484978920580143494fba5f932b151fcdd790b9",
      "bytes": 29050
    },
    {
      "path": "docs/reviews/stage-1a/README.md",
      "sha256": "f56a1c374e9c39eacd077fe306cd8115f4af37120cfb6d6427be13e53052489c",
      "bytes": 2087
    },
    {
      "path": "docs/reviews/stage-1a/SKILL_EVALUATION_MATRIX.csv",
      "sha256": "4ef291da0a36ce812f452f7ab0dc913b65e47145f1955870905eadf0663c7662",
      "bytes": 11734
    },
    {
      "path": "docs/reviews/stage-1a/SKILL_SECURITY_REVIEW.md",
      "sha256": "5db065a60c92355589a0a31a2a49fe071074898cceceaded28e475b142e231e2",
      "bytes": 8147
    },
    {
      "path": "docs/reviews/stage-1a/STAGE_1A_READINESS_REPORT.md",
      "sha256": "bc4205827032fe4d922d57d5af0e92a9fb1a4d9be1cbd968303531532fd23358",
      "bytes": 11172
    },
    {
      "path": "docs/reviews/stage-1a/STAGE_1A_VALIDATION_AND_CHANGE_MANIFEST.json",
      "sha256": "3d810eb1c33dc1dc2ee5f6a03984522412f1ba435716992e488a75933955ad04",
      "bytes": 33022
    },
    {
      "path": "docs/reviews/stage-1a/STAGE_2_ENTRY_GATE_AND_SEQUENCE_DECISION.md",